Algorithm	Type	Math Function	Explanation	Advantages	Disadvantages	Supervised or Unsupervised	Loss Function
Few-shot learning 			Using a very small example-to-class ratio for small training sets, for example in a 5-way 1-shot problem there are five classes with one example each, uses a support set to sample training tasks that mimic the use-case scenario during prediction, where each training task has a query image to be classified and the model is trained on several training tasks from the support set in an "episode", where the classes in the support and query sets differ from the support and query sets encountered during training, where one few-shot strategy is to learn a model that produces embeddings so we can find the target class with a nearest-neighbor search among the images in the support set, where the model learns how to produce good embeddings from the support set to classify the query image based on finding the most similar embedding vector		Supervised
Meta-learning (few shot)	Few shot learning type 		Training updates the model's parameters so it can adapt well to a new task 			Supervised

Loss/error functions	Function Type			Quantifies how well one prediction of the machine learning algorithm compares to the actual target value during training thereby providing the signal for the model's learning algorithm to update weights and parameters
Mean Absolute Error	Regression Loss Function 	1/n * Σ for all n |actual yj - predicted yj| 		Sensitive to outliers
Mean Squared Error	Regression Loss Function	1/n * Σ for all n of (actual yᵢ - predicted yᵢ)²		Penalizes larger errors heavily
Mean Absolute Percentage Error	Regression Loss Function			Used to express the error in terms of percentage	 where the smaller the percentage the better the model performance
Root Mean Squared Error	Regression Loss Function	√(Σ for all n (actual yi - predicted yi)^2) / N		Indicates how much the data points are spread around the best line and is the standard deviation of the MSE	 where lower value means that the data point lies closer to the best fit line.
Root Mean Squared Log Error	Regression Loss Function 	√ (Σ for all n (log(actual yi + 1) - log(predicted yi + 1))^2 / N)
Huber Loss
Los-cosh Loss 	Regression Loss Function 	Σ log(cosh(predicted yi - actual yi)) 	Log-cosh loss is a smooth alternative to MAE that is less sensitive to outliers

Cross Entropy Loss	Loss Function	-Σ for all n (true label yᵢ * log(predicted probability pi for class i)) where the true label is a one-hot encoded vector which is 1 for the correct class and 0 for incorrect classes	Cross entropy is used to measure the distance between two probability distributions such as using the discrete cross-entropy loss (CE) between class label y and the predicted probability p when training logistic regression or neural network classifiers on a dataset of n examples

Binary Cross Entropy Loss 	Binary Classification Loss Function 	-1/n * Σ for all n [actual yi * log (predicted yi) + (1 - actual yi) * log(1 - predicted yi) 	Used in binomial logistic regression, measures how close predictions are to actual class probabilities
Hinge Loss	SVM Binary Classification Loss Function	max(0, 1 - yᵢ(w·xᵢ + b)) 	Encourages a large margin between classes

Categorical Cross Entropy Loss 	Multiclass Classification Loss Function - Σ for all n actual yi * log(predicted yi) 	Generalization of binary cross entropy for > 2 classes
Sparse Categorical Cross Entropy Loss 	Multiclass Classification Loss Function with sparse labels 			Optimized for memory, labels don't need to be one-hot		
KL Divergence 	Probabilistic Classification 		Measures divergence from true distribution

Focal Loss 	Imbalanced Classification Loss Function 			Focuses learning on hard misclassified examples
Hinge Loss/Margin Ranking Loss 	Ranking Loss Function 			Encourages correct order of relevance
Triplet Loss 	Loss Function used in Face Recognition, Embeddings 			Encourages anchor-positive closeness and anchor-negative separation
Dice Loss/IoU Loss 	Image segmentation Loss Function 			Measures overlap and is robust when classes are imbalanced
Connectionist Temporal Classification Loss 	Sequence model Loss Function 			Enables training without aligned input-output sequences
Wasserstein Loss 	GAN/WGAN Loss Function 			Stabilizes gradients in training generative models
Exponential Loss 	Adaboost Loss Function

Log Loss	Regression Loss Function	-1/n * Σ for all points n Σ for all classes m yij * log(pij)	Used in multinomial logistic regression and neural networks
R2 loss	Regression Loss Function 	Ratio of the sum of squares residual (SSR the total variation of predicted values from the mean) and the sum of squares total (SST the total variation of actual values from the mean) = 1 - Σ for all n (actual yi - predicted yi)^2 / Σ for all n (actual y - y mean)^2 = 1 - Mean squared error/Var(y)	The coefficient of determination R2 measures the proportion of the variation in the dependent variable that can be explained by independent variables	Less sensitive to outliers
Adjusted R2 loss 	Regression Loss Function

Entropy	Information uncertainty function	Entropy H(S) = -Σ for all k (pᵢ log₂ pᵢ) where pᵢ is the proportion of the dataset belonging to class i	entropy encodes the number of info bits required to represent information and a decision tree tries to reduce the entropy by splitting the data on features that provide the most information about the target variable
Shannon Entropy 	Entropy type 	The expected amount of information/surprise in a random variable is information(x) = -log(p(x))	log is the base 2 log or natural log and p(x) is the probability of event x
Cross Entropy 	Entropy type 	The distance between the true distribution p and the predicted distribution q
Conditional Entropy 	Entropy type 	The average uncertainty remaining in Y given that X is known
Kullback-Leibler Divergence (Relative Entropy)	Entropy type 	Indicates how a probability distribution diverges from a second expected distribution
Differential Entropy 	Entropy type 	Differential entropy is entropy for continuous random variables
Joint Entropy 	Entropy type 	The uncertainty of two variables together 
Renyi Entropy (generalization of Shannon) 	Entropy type 	Renyi entropy is a tunable generalization of entropy for different sensitivity levels
Tsallis Entropy 	Entropy type 	Tsallis entropy is another generalization of entropy used in non-extensive systems like complex networks

Gini Impurity	Information impurity function	Gini G(S) = 1 - Σ for all k (pᵢ)²	 The lower the Gini Impurity the better the feature splits the data into distinct categories
Information Gain	Feature Selection Filter Method	IG = entropy H(S) - entropy H(S|a) = entropy H(S) - Σ for all values v in attribute A |Sv|/|S| * H(Sv) information gain = entropy of a node of the decision tree minus the entropy of a candidate split at node t of a decision tree	Measures how well an attribute reduces uncertainty/entropy where a greedy algorithm would split data based on which attribute maximizes information gain (reduces uncertainty/entropy) in a set S which is calculated using the difference in entropy before and after the split	it tends to choose the most impactful features close to the root of the tree and is a good measure for deciding the relevance of some features	One major drawback of information gain is that the feature that is chosen as the next node in the tree tends to have more unique values
Phi function 	Decision tree split function 	phi = 2 * PL * PR * Q(s|t) 	the phi function decides relevance based on goodness of a split at a node and the phi function is maximized when the chosen feature splits the samples in a way that produces homogenous splits and have around the same number of samples in each split
Gain Ratio	Information entropy function 	[-Σ for all n H(T) * log(H(T)) - (-Σ for all n H(T|a) * log(H(T|a))) ]/ -Σ for all n N(ti)/N(t) * log base 2 (N(ti)/N(t)) where N(xi) is the number of times xi occurs and H(T) is the entropy of T		Improves on information gain by considering the worth of attributes with a wide range of possible values thereby handling the bias of information gain to favor attributes with more pronounced values

Centroid-based Clustering Method Clustering Method Type			Represent clusters using central points like centroids or medoids
K-Means	Centroid-based Clustering Method	The objective is to find argmin Σi in K Σx in Si ||xᵢ - μ_k||² = argmin Σi in K |Si| Var Si (for each cluster k) where Si is the size of the set of points in cluster k and μ_k is the centroid of cluster k where each observation is a d-dimensional vector, aiming to partition the n observations into k <= n sets so as to minimize the within-cluster sum of squares WCSS (variance) and which is equivalent to minimizing the pair-wise squared deviations of points in the same cluster, picking k centers, assigning each point to the closest center and then updating centers based on the average of assigned points, repeating until assignments stabilize	Minimizes within-cluster variance by grouping data by proximity with the cluster centroids discovered from unlabeled data	Simple and fast and works well with spherical clusters with similar sizes and scalable	Needs K specified and spherical classes and is sensitive to noise	Unsupervised		Sum of squared errors
k-median clustering 	Clustering Method
K-means++ clustering Centroid-based Clustering Method
K-mode clustering Centroid-based Clustering Method
Fuzzy C-means (FCM) Clustering Centroid-based Clustering Method

Distribution-based Clustering	Clustering Method Type
Gaussian Mixture Models (GMMs)	Distribution-based Clustering Method 			Models clusters as overlapping Gaussian distributions, assigning probabilities for data points' cluster membership
Expectation-Maximization Algorithms Distribution-based Clustering Method
Dirichlet Process Mixture Models (DPMMs)	Distribution-based Clustering Method

Connectivity-based Clustering method 	Clustering Method Type
Hierarchical Clustering	Connectivity-based Clustering	d(A	B) = min/max/avg ||a - b||	Agglomerative clustering based on distance linkage, building a tree-like structure by merging or splitting clusters	Dendogram visualization and no need to specify k	Computationally expensive	Unsupervised		Distance-metric based
Within-Cluster Sum of Squares - WCSS	K-means clustering objective function Σk in K Σx in Sk ||xᵢ - μ_k||² for all Sk where Sk is the set of points in cluster k and μ_k is the centroid of cluster k
Agglomerative Clustering	Connectivity-based Clustering
Divisive Clustering	Connectivity-based Clustering
Affinity Propagation 	Connectivity-based Clustering

Density-based Clustering Method 	Clustering Method Type
DBSCAN (Density-Based Spatial Clustering of Applications with Noise)	Density-based Clustering	ε-neighborhood with density ≥ minimum points	Forms clusters defined by density regions	Handles noise and outliers and arbitrary shapes	Struggles with different densities	Unsupervised
OPTICS (Ordering Points to Identify the Clustering Structure)	Density-based Clustering

Neural Networks	Classification	J(θ) = (1/m) Σ Loss(yᵢ,ŷᵢ)	Backpropagation minimizes loss via gradient descent using layers of neurons that apply weighted transformations followed by non-linear functions, learning by backpropagating error and updating weights by gradient descent	Captures complex patterns and non-linear relationships			Cross entropy loss
Neural Networks	Regression							Mean squared error
Gradient Descent	Optimization function	the update rule θj :=θj − (α ^ ∂/∂θj) * J(θ)
Stochastic Gradient Descent 	Optimization function
Batch Gradient Descent
Adam Gradient Descent
Backpropagation	Neural network weight update function			applies the chain rule to compute the gradient of the loss function with respect to each weight in the network
Multilayer Perception 	Neural Network Type for Classification and Regression 		Neural network with multiple layers of nodes
Deep learning 	Learning Type		Uses neural networks with many layers 	useful for tasks involving large datasets and high-dimensinoal data
Feedforward Neural Networks (FNN) Deep Learning Network Type used for classification and regression 	Basic neural network model 	Easy to train and is useful for simple tasks
Convolutional Neural Networks (CNN)	Deep Learning Network Type 			Good for handling grid-like data and learns spatial hierachies of features
Generative Adversarial Networks (GANs)	Deep Learning Network Type 			Useful for generating synthetic data closely resembling real data
Transformer Networks 	Deep Learning Network Type 			Used in sequence-to-sequence tasks 	Efficiently handles long-range dependencies and parallelizes training

Hopfield Network 	Neural Network Type
Radial Basis Function Network (RBFN) 	Neural Network Type
Deep Boltzmann Machine (DBM) Neural Network Type
Deep Belief Networks (DBN) Neural Network Type

Reinforcement Learning 	Learning Type		Q(s,a) ← Q(s,a) + α[r + γ max Q(s’,a’) - Q(s,a)] uses a Bellman equation update 		The model learns by making a sequence of decisions interacting with an environment and receiving rewards/penalties, with a goal of maximizing cumulative reward, categorized into model-based and model-free methods
Model-based Reinforcement Learning 	Reinforcement Learning Type 		Uses an environment model to predict outcomes and help the agent plan actions by simulating potential results
Markov Decision Processes (MDPs)	Reinforcement Model-based Learning Type 	
Bellman equation	Reinforcement Model-based Learning Type 	
Value iteration algorithm 	Reinforcement Model-based Learning Type 	
Monte Carlo Tree Search 	Reinforcement Model-based Learning Type 	
Model-free Reinforcement Learning 	Reinforcement Learning Type 		Model-free methods dont depend on an environment model but instead learn directly from experience by interacting with the environment and adjusting actions based on feedback, which have value-based and policy-based methods
Value-based Model-free Reinforcement Learning 	Reinforcement Learning Model-free Type 		Value-based methods learn the value of different states or actions where the agent estimates the expected return from each action and selects the one with the highest value
Q-Learning 	Value-based Model-free Reinforcement Learning Type 			Used for decision-making in sequential tasks	Can learn optimal policies even with limited environment knowledge
Deep Q-Networks (DQN) 	Reinforcement Learning Network Type 		Handles more complex reinforcement learning with deep learning, combining q-learning with deep neural networks, allowing it to handle large state spaces
SARSA 	Value-based Model-free Reinforcement Learning Type
Monte Carlo Methods 	Value-based Model-free Reinforcement Learning Type
Policy-based Model-free Reinforcement Learning 	Reinforcement Learning Model-free Type 		Policy-based methods directly learn a policy (a mapping from states to actions) without estimating values where the agent continuously adjusts its policy to maximize rewards
REINFORCE algorithm 	Policy-based Model-free Reinforcement Learning Type
Actor-Critic algorithm 	Policy-based Model-free Reinforcement Learning Type
Asynchronous Advantage Actor-Critic (A3C) 	Policy-based Model-free Reinforcement Learning Type
Policy Gradient Methods	Reinforcement Learning Type 		Learns policies directly for reinforcement learning tasks	Useful for tasks with continuous action spaces or complex environments
Proximal Policy Optimization (PPO) 	Reinforcement Learning Type 		PPO is reinforcement learning with stable and efficient updates 	Useful for large-scale problems with complex environments

Recurrent Neural Networks (RNNs)	Network Type		handles sequential data by maintaining a memory of previous inputs and used for Sequence Modeling and Time Series Prediction and Natural Language Processing		Struggle with long-term dependencies and have vanishing gradients (solved by LSTM and Gated Recurrent Unit)	
Long Short-Term Memory (LSTM) networks	Recurrent Neural Network Type	Models sequences with long-range dependencies	Addresses the vanishing gradient problem in RNNs

Semi-supervised learning 	Learning type 	A hybrid between supervised and unsupervised learning that uses both labeled and unlabeled data for training 	Often used with large datasets when labeling data is expensive or time-consuming
Self-supervised learning 	Learning Type 	Self-supervised learning is a subset of unsupervised learning where the model learns to predict parts of the data from other parts of the data without explicit labels	Is useful when labeling data is not possible

Association rules algorithms 	Algorithm Type 	association rules algorithms find patterns between items in large datasets based on the frequency of item occurrences and co-occurrences
Apriori algorithm 	Association Rule Algorithm Type 		Finds frequent itemsets by iterating through data and pruning non-frequent item combinations
FP-Growth (Frequent Pattern-Growth)	Association Rule Algorithm Type 		Efficiently mines frequent itemsets using a compressed FP-tree structure without candidate generation
ECLAT (Equivalence Class Clustering and bottom-up Lattice Traversal)	Association Rule Algorithm Type 		Uses vertical data format for faster frequent pattern discovery through efficient intersection of itemsets

Max Pooling 	Neural Network layer type			Selects a maximum of inputs in pool, and downsamples feature maps	 Reduces computation
Average Pooling 	Neural Network layer type 		Averages inputs in pool
Flatten 	Neural Network layer type			Converts 2D to 1D
Dense (Fully Connected) 	Neural Network layer type			All nodes in the layer are connected to all nodes in the next layer

TF-IDF	Vectorization			Optimizes memory usage by creating a sparse matrix by multiplying importance weight (as in how often a word appears in a document) by how unique a word is (to reduce importance of common words) across the entire collection of documents so words appearing in many documents get a lower IDF score and rare words get a higher score and in the process converts text to vectors handling a large vocabulary in the process
Word2vec	Vectorization			Uses a two-layer neural network to encode words into embedding vectors for semantic and syntactic similarity using either continuous bag of words or skip gram to infer a word from context or vice versa	skip gram is more effective for infrequent words and CBOW is faster to train
One-Hot Encoding	Vectorization			Converts a word into a vector with a bit corresponding to the index in the vocabulary with all other bits set to zero 		Using one-hot encoding with categorical variables of high cardinality is suboptimal bc of the curse of dimensionality
Binary Encoder 	Vectorization
Label Encoding	Vectorization
Ordinal Encoding	Vectorization
Target Encoding	Vectorization
Bag of Words	Vectorization			Represents text data as a vector of word counts

Dimensionality reduction	Function Type			used to simplify datasets by reducing the number of features while retaining the most important information.
Principal Component Analysis (PCA)	Signal Processing and Dimensionality Reduction to 2d	maximize var(Z) s.t. Z = Xw and ||w||=1, find the covariance matrix, find the eigenvalue decomposition of the covariance matrix and find the projection with the eigenvectors of the covariance matrix, PCA transforms data into a new set of axes or orthogonal features (principal components) that capture the maximum variance, keeping the most important components	Reduces overfitting and reduces the number of features while retaining the variance and fast and improves visualization	Components may be hard to interpret and disregards independence of components and misses non-linear patterns	Unsupervised		Minimizes variance loss
Principal Component Regression (PCR) 	Dimensionality Reduction
Independent Component Analysis (ICA)	Signal Processing and Dimensionality Reduction			separates mixed signals into their independent non-Gaussian components thereby finding a linear transformation of data that maximizes statistical independence among the components which is used in signal analysis to isolate distinct sources from mixed signals	Doesnt require labeled data and is non-parametric so it doesnt require assumptions about the data probability distribution and can be used for feature extraction to identify important features	Assumes decomposed source features are non-gaussian and are independent and are mixed linearly and ICA can be computationally expensive	Unsupervised
Linear Discriminant Analysis (LDA)	Dimensionality Reduction	J(w) = |wᵗ S_B w| / |wᵗ S_W w|	Maximize class separation
Mixture Discriminant Analysis (MDA)
Quadratic Discriminant Analysis (QDA)
Flexible Discriminant Analysis (FDA)
Autoencoders	Dimensionality Reduction and Anomaly Detection	L = ||x - x'||²	Neural network that compresses and reconstructs data to minimize reconstruction loss, learning efficient representations of data	Useful for dimensionality reduction and feature learning and anomaly detection, works well with high-dimensional data
Stacked Auto-Encoders 	Neural Network Type
t-Distributed Stochastic Neighbor Embedding (t-SNE)	Dimensionality Reduction	Pᵢⱼ ∝ exp(-||xᵢ - xⱼ||²/2σ²)	Minimize Kullback-Leibler divergence between high and low dimensional distributions and thereby reduces dimensions for visualizing high-dimensional data and preserving local relationships	Captures complex structure unlike PCA and is effective at reducing the dimensionality of complex data	Slower and non-deterministic	Unsupervised		Minimizes pairwise differences
Non-negative Matrix Factorization (NMF)	Dimensionality Reduction			Factorizes data into non-negative components	useful for sparse data like text or images
Isomap	Dimensionality Reduction			Preserves geodesic distances to capture non-linear structures in data
Locally Linear Embedding (LLE)	Dimensionality Reduction			Preserves local relationships by reconstructing data points from their neighbors
Latent Semantic Analysis (LSA)	Dimensionality Reduction			Reduces the dimensionality of text data to reveal hidden patterns
Partial Least Squares Regression (PLSR) 	Dimensionality Reduction Type
Sammon Mapping	Dimensionality Reduction Type
Multidimensional Scaling (MDS)	Dimensionality Reduction Type
Projection Pursuit	Dimensionality Reduction Type
Uniform Manifold Approximation and Projection for Dimension Reduction (UMAP)	Dimensionality Reduction Type
Singular Value Decomposition	Dimensionality Reduction Type
Neighborhood Component Analysis
Relief Algorithm

Statistical independence	Concept			refers to the idea that two random variables: X and Y are independent if knowing one does not affect the probability of the other so the joint probability of X and Y is equal to the product of their individual probabilities
Covariance Matrix	matrix used in PCA			summarizes relationships between different variables
Eigenvectors/eigenvalues in PCA	matrix attributes used in PCA			the principal components are the eigenvectors of the covariance matrix and the eigenvalues represent the variance explained by each component where the objective is to find the eigenvectors of the largest eigenvalues
Eigenvector 	Matrix attribute 	Aftering finding eigenvalues, find the eigenvector (a nonzero vector that changes scale by an eigenvalue when multiplied by a matrix A) associated with eigenvalue_i: (matrix A - eigenvalue_i * identity matrix I) * eigenvector v = 0, where if multiplying A by v scales v by a factor of the scaler lambda then v is an eigenvector of A and lambda is the corresponding eigenvalue https://en.wikipedia.org/wiki/File:Eigenvalue_equation.svg
Eigenvalue 	Matrix attribute 	Find eigenvalues (scalers that scale an eigenvector) by solving for the roots of the equation resulting from the determinant = 0: det(matrix A - eigenvalues λ * identity matrix I) = 0, then find eigenvectors for each eigenvalue
Determinant of a matrix	Matrix attribute 	The 2x2 determinant is ad - bc and the 3x3 determinant is aei + bfg + cdh - ceg - bdi - afh, or can be expressed as the sum of n! signed products of matrix entries, or a linear combination of determinants of sub-matrixes, or can be expressed with gaussian elimination using the row echelon form

z-score	Evaluation Metric	z = (x - mean)/standard deviation		Standardizes x value
t-score	Evaluation Metric	estimated value - assumed value / standard error	Uses the student's t-distribution to calculate the number of standard deviations from the mean
Confidence Interval 	Evaluation Metric 	A range of values used to estimate a population parameter like the mean, where a 95% confidence interval indicates that 95 of 100 repeated samples with the same sampling method overlap with the actual population value of the parameter, where the confidence interval reflects the reliability of the sampling method used to generate the intervals, so the true mean lies in the confidence interval 95% of the time
Bayes factors
Likelihood ratios
Expected value
Covariance
Correlation
Multicollinearity 	Data interaction concept 	Multicollinearity is where features are correlated, which reduces the robustness of a model
Variance	Evaluation Metric	variance = expected value E of (x - mean)^2 for a random variable, or the covariance of a random variable with itself, or the second cumulant of a probability distribution that generates X: E[X^2] - E[X]^2
Standard deviation	Evaluation Metric	standard deviation = square root of the variance
Standard error	Evaluation Metric	standard error = standard deviation / √n
Kurtosis	Distribution Metric			Kurtosis is a statistical measure that describes the shape of a distribution particularly the "peakedness" or "tailedness" of the data
Skewness	Distribution Metric		Skewness is a measure of the asymmetry of the probability distribution of a real-valued random variable about its mean
