Algorithm	Type	Math Function	Explanation	Advantages	Disadvantages	Supervised or Unsupervised	Loss Function
Euclidean distance between two points	Continuous distance metric		In one dimension d(x, Xi) = √(Σ for all n (xj - Xij)^2) and in two dimensions, the distance d(p,q) = √((p1 - q1)^2 + (p2 - q2)^2)	A commonly used distance metric for continuous variables is Euclidean distance
Manhattan distance 	Distance metric 	d(x,y) = Σ for all n |xi - yi|
Minkowski distance 	Distance metric 	d(x,y) = (Σ for all n (xi - yi)^p)^p_mean 	Represents Euclidean distance with p = 2 and Manhattan distance with p = 1
Hamming distance (overlap metric)	Discrete distance metric
Norm Vector Concept A norm is a function from a real or complex vector space to the non-negative real numbers that behaves in certain ways like the distance from the origin: it commutes with scaling, obeys a form of the triangle inequality, and zero is only at the origin. In particular, the Euclidean distance in a Euclidean space is defined by a norm on the associated Euclidean vector space, called the Euclidean norm, the 2-norm, or the magnitude or length of the vector. This norm can be defined as the "square root of the inner product of a vector with itself"
Seminorm	Vector concept	Satisfies the first two properties of a norm but can be zero for vectors other than the origin
A normed vector space Vector concept		A vector space with a specified norm

Accuracy	Classification Evaluation Metric	TP + TN/TP + TN + FP + FN	
Precision (Positive Predictive Value)	Classification Evaluation Metric	TP/TP + FP		Weights false positive predictions as important thereby analyzing the positive predictions	Does not consider True Negatives and False Negatives
Recall/sensitivity (True positive rate)	Classification Evaluation Metric	TP/TP + FN		Weights false negative predictions as important thereby analyzing the correct positive examples	Unfortunately it often emphasizes a higher false positive rate
False positive rate 	Classification Evaluation Metric 	FP/FP + TN
Specificity (True negative rate)	Classification Evaluation Metric 	TN/TN + FP
Miss rate (False negative rate)	Classification Evaluation Metric 	FN/FN + TP
False Discovery Rate 	Classification Evaluation Metric 	FP/FP + TP
False Omission Rate 	Classification Evaluation Metric 	FN/FN + TN
F1 score	Classification Evaluation Metric	2*(Precision * Recall)/(Precision + Recall)		if we increase the precision the recall decreases and vice versa so the harmonic mean of precision and recall combines these two metrics to offset that trade-off	best for uneven classes
Cross-validated F1-score	Classification Evaluation Metric			helps avoid overfitting
Mean F1 score	Classification Evaluation Metric
Confusion Matrix	Classification Evaluation Metric			Compares counts of actual vs. predicted outputs for each of N target classes to compare predictions (true/false positives and true/false negatives)
AUC (Area under the ROC curve)	Classification Evaluation Metric 		Represents degree or measure of separability (evaluates how well the model can separate the classes by analyzing the classification model at different threshold values) where a score close to 1 is ideal, 0 is the worst possible score and 0.5 indicates the model has no class separation capacity, which uses the TPR and FPR	Good for binary classification
Receiver Operating Characteristic ROC curve	Classification Evaluation Metric curve			A probability curve that compares true positive rate (recall/sensitivity) and the false positive rate and determines the model's capacity to distinguish between different classes and is used to predict the probability of the binary outcome	Good for binary classification 	Overly optimistic at estimating performance in highly skewed domains
Precision-Recall Curve	Classification Evaluation Metric		Plots the precision vs the recall for different probability thresholds, which are recommended for highly skewed domains where ROC curves can provide an overly optimistic view of the performance	Good when the positive class is rare and in highly skewed domains
PR AUC 	Classification Evaluation Metric 		The PR AUC summarizes the curve with a range of threshold values as a single score, where a high PR AUC indicates high recall and high precision, where high precision is a low false positive rate and high recall is a low false negative rate, where the AU ROC uses TPR and FPR and AUC PR uses positive predictive value PPV and TPR, where AUC PR is more useful if true negatives arent relevant or the positive class is relevant, but AUC ROC is useful where the positive and negative classes are relevant or the dataset is balanced
Silhouette Score	Clustering Evaluation Metric 	

Learning Curve	Function Type			Compares how well increasingly large training sets perform on the same test set to evaluate if the model would benefit from more data where if the validation accuracy increases with training set size it indicates underfitting and that more data would be useful and where a gap in training and test set accuracy indicates overfitting and where additional data can decrease both underfitting and overfitting

Filter Methods	Feature Selection Method			Evaluate each feature independently with target variable where features with high correlation with target variable are selected as it means this feature has some relation and can help make predictions where these methods are used in the preprocessing phase to remove irrelevant or redundant features based on statistical tests (correlation) or other criteria	Quickly evaluate features without training the model and good for removing redundant or correlated features and Filter methods are often preferred for very large datasets due to their speed	These methods don't consider feature interactions so they may miss feature combinations that improve model performance
Chi-square test	Feature Selection Filter Method			It is generally used to test the relationship between categorical variables. It compares the observed values from different attributes of the dataset to its expected value.
Fisher’s Score	Feature Selection Filter Method			Fisher's selects each feature independently according to their scores under Fisher criterion leading to an optimal set of features so a larger the Fisher’s score indicates a better selected feature
Pearson’s Correlation Coefficient	Feature Selection Filter Method			pearson's coefficient is a measure of quantifying the association between the two continuous variables and the direction of the relationship with its values ranging from -1 to 1
Variance Threshold	Feature Selection Filter Method			variance threshold is an approach where all features are removed whose variance doesn’t meet the specific threshold and by default this method removes features having zero variance and the assumption made using this method is higher variance features are likely to contain more information
Mean Absolute Difference	Feature Selection Filter Method			Mean absolute difference is a method is similar to variance threshold method but the difference is there is no square in this method
Dispersion ratio	Feature Selection Filter Method			It is defined as the ratio of the Arithmetic mean (AM) to that of Geometric mean (GM) for a given feature whose value ranges from +1 to infinity as AM ≥ GM for a given feature where a higher dispersion ratio implies a more relevant feature

Hypothesis Testing	Statistical test type			Commonly used in outlier detection, includes t-test, chi-square, ANOVA
One-sample t-test 	Statistical test 		One number predicts y
Wilcoxon signed rank Statistical test 		One number predicts the signed rank of y

Paired-sample t-test 	Statistical test 		One intercept predicts the pairwise y2 - y1 differences
Wilcoxon matched pairs 	Statistical test 		One intercept predicts the signed rank of the pairwise differences y2 - y1

Pearson correlation 	Statistical test 		One intercept plus x multiplied by a number (slope) predicts y with continuous x
Spearman correlation 	Statistical test 		One intercept plus ranked x multipled by a number (slope) predicts ranked y with continuous x

Two-sample t-test 	Statistical test 		An intercept for group 1 (plus a difference if group 2) predicts y with discrete x
Welch's t-test 	Statistical test 		An intercept for group 1 (plus a difference if group 2) predicts y, with one variance per group instead of one common variance with discrete x
Mann-Whitney U 	Statistical test 		An intercept for group 1 (plus a difference if group 2) predicts signed rank of y with discrete x
One-way ANOVA 	Statistical test 		An intercept for group 1 (plus a difference if another group) predicts y with discrete x
Kruskal-Wallis 	Statistical test 		An intercept for group 1 (plus a difference if another group) predicts rank of y with discrete x
Goodness of fit 	Statistical test 	An intercept for group 1 (plus a difference if another group) and a family like the poisson family predicts y with discrete x

One-way ANCOVA 	Statistical test 		An intercept for group 1 (plus a difference is another group) plus a slope on x predicts y, with continuous x

Two-way ANOVA 	Statistical test 		An intercept plus x1 terms and x2 terms plus x1,x2 interaction terms (changing one x term changes the other x-term in an interaction term)
Chi-square test 	Statistical test 	A log(intercept) plus log(x1) terms and log(x2) terms plus log(x1,x2) interaction terms where inputs are proportions and x is discrete and a family like the poisson family

Student's t-test 	Statistical test 	
ANOVA Statistical test 		Provides a statistical test of whether two or more population means are equal, generalizing the t-test beyond two means, and uses an f-test to compare the means of two groups by analyzing variance, comparing amount of variation between each group means to the amount of variation within each group, where if between-group variation is larger, it means the group means are likely different, based on the law of total variance in which the total variation in a dataset can be broken into components from different variation sources, and where the f-test of ANOVA follows the normality, homogeneity of variance, independence of errors and random sampling assumptions
ANCOVA 	Statistical test
MANOVA 	Statistical test
F-test 	Statistical test 	The test statistic in an f-test is the ratio of two scaled sums of squares reflecting different sources of variability, constructed so the statistic is often greater when the null hypothesis is false, where the sums of squares should be independent and should follow a scaled chi-squared distribution which is guaranteed if the data values are independent and normally distributed with a common variance, where the formula for one-way ANOVA f-test statistic is explained variance or between-group variability or Σ for all K ni * (sample mean in ith group Yi - overall mean Y)^2/(K - 1) / unexplained variance or within-group variability or Σ for all K Σ for all ni (jth observation in the ith out of K groups Yij - sample mean in ith group Yi)^2/(N - K) where N is the overall sample size, which follows the f-distribution with degrees of freedom d1 = K - 1 and d2 = N - K under the null hypothesis, which will be a large value if the between group variability is relatively large which is unlikely if the population means of the groups are equal	The f-test is a statistical test that compares variances to determine if the variances of two samples (or a ratio of variances among multiple samples) are significantly different, calculating the F statistic and checking if it follows and F distribution, where f-tests are frequently used to compare different statistical models and find the one that best describes the population the data came from, where when models are created with least squares the resulting f-tests are called exact f-tests, and is used in cases like to test the hypothesis that the means of a set of normally distributed population with the same standard deviation are equal, or the hypothesis that a regression model fits the data well, or the hypothesis that a data set in a regression analysis follows the simpler of two nested linear models, where multiple-comparison testing is done after completing an f-test if the f-test leads to a rejection of the null hypothesis and the factor being studied impacts the dependent variable. The result of the f-test is determined by comparing calculated F value and the critical F value with specific significance level like 5% where the f-table contains critical F values given degrees of freedom for the distribution of the f-statistic under assumption of a true null hypothesis, the f table is designed to determine the threshold beyond which the f statistic is expected to exceed a specific percent of the time (5%) when the null hypothesis is accurate, where if the F statistic < critical F value, the null hypothesis is accepted and there is no significant difference among sample averages and observed differences can be caused by randomness and the result is not significant, where if the F statistic > critical F value, the null hypothesis is rejected and there is significant difference among sample averages and observed differences in sample averages couldnt be reasonably caused by randomness and the result is significant, where when there are only two groups in one-way ANOVA f-test, F = t^2 where t is the student's t statistic, where another use of the f-test is to determine if a nested model is significantly better than the model it's nested in by comparing the residual sum of squares F = (RSS1 - RSS2/p2 - p1) / (RSS2/n - p2) where RSSi is replaced with the weighted sum of squared residuals if the regression model has been calculated with weights, where F will have an F distribution with (p2 - p1, n - p2) degrees of freedom and where the null hypothesis is rejected if F > critical value of the F distribution for a false-rejection probability like 0.05	The f-test is useful for multi-group comparison efficiency, clarity in variance comparison, versatility across disciplines, and allows not specifying which groups should be compared, instead comparing all groups	The f-test is sensitive to homogeneity of variance and non-normality so has alternative tests like Levene's, Bartlett's, and the Brown-Forsythe test and has limited scope to group comparisons specifically comparing variances between groups, and has interpretation challenges by not identifying specific group pairs with distinct variances and if the null hypothesis is rejected, it's not clear which groups significantly differ, nor can it be said that the group pair with the greatest mean difference is significantly different at the level alpha which the f-test was performed at
Likelihood ratio test 	Statistical test 		F is a monotone function of the likelihood ratio statistic so the F-test is a likelihood ratio test
Degrees of freedom 	Statistical test variable 		The number of degrees of freedom is the number of values in the final calculation of a statistic that are free to vary

Wrapper Method	Feature Selection Method			Greedy algorithms that train algorithms using different combinations of features and computing relations between these subset features and the target variable and add/remove features with stopping criteria being potentially whenever the model performance decreases or a specific number of features is achieved	Can lead to better model performance since they evaluate feature subsets in the context of the model and can capture feature dependencies and interactions	But are computationally more expensive than filter methods especially for large datasets
Forward selection	Feature Selection Wrapper Method			Forward selection is an iterative approach where we initially start with an empty set of features and keep adding a feature which best improves our model after each iteration where the stopping criterion is where the addition of a new variable does not improve the performance of the model
Backward elimination	Feature Selection Wrapper Method			Backward elimination is a method that is also an iterative approach where we initially start with all features and after each iteration we remove the least significant feature where the stopping criterion is where no improvement in the performance of the model is observed after the feature is removed
Recursive elimination	Feature Selection Wrapper Method			Recursive elimination is a greedy method that selects features by recursively removing the least important ones where it trains a model and ranks features based on importance and eliminates them one by one until the desired number of features is reached

Embedded Method	Feature Selection Method			Embedded methods perform feature selection during the model training process and combine the benefits of both filter and wrapper methods and include Lasso regularization, decision trees, random forests, and gradient boosting which all select important features	 where feature selection is integrated into the model training allowing the model to select the most relevant features based on the training process dynamically	More efficient than wrapper methods because the feature selection process is embedded within model training and is often more scalable than wrapper methods and Wrapper and embedded methods are better for capturing complex feature interactions	Works with a specific learning algorithm so the feature selection might not work well with other models

Loss function	Function Type			The loss function Loss(a(x),y) defines the cost of making decision a(x) when the true state is y for a single example
Cost function	Function Type	1/n * Σ for all n Loss(actual yi, predicted yi) 	An average or total of the loss function for an entire training set containing several training examples thereby quantifying the model's performance on the whole training dataset, the expected value of the loss function across the data
Objective function 	Function Type 	The objective function refers to any function being optimized/minimized/maximized during training, such as the cost function (error term), regularization terms, complexity, sparsity, or accuracy
Risk function	Function Type			The risk function combines the loss function and the decision rule and the probabilities where the risk of a decision rule a(x) is the Σ for x,y of the (expected loss(a(x),y) * probability P(x,y)) where the decision rule that minimizes the risk is selected

Cross validation	Function Type		Some part of the dataset is reserved for testing the model. There are many types of Cross-Validation out of which K Fold Cross Validation is mostly used
K-fold cross validation	Cross Validation and Generalization Method			The original dataset is divided into k subsets (folds) and this is repeated k times where 1 fold is used for testing purposes and the rest k-1 folds are used for training the model which generalizes the model well and reduces the error rate, where the performance on each fold is averaged once all folds are trained 	More cross validation folds reduces the chance of overfitting
Holdout is a simpler approach	Cross Validation and Generalization Method			the dataset is divided into ratios like 80:20 of train and test datasets and is used in neural networks and many classifiers
Adversarial Validation	Validation Type	

Hyperparameters	Variable Type
Learning Rate	Hyperparameter			Learning rate determines the jump interval for gradient descent
Batch size 	Hyperparameter
N estimators 	Random forest hyperparameter 		Number of trees in a random forest
Max depth 	Decision tree hyperparameter 		Maximum number of levels in a decision tree
Minimum samples split 	Decision tree hyperparameter 		Minimum number of data points in a node before the node is split
Minimum samples leaf 	Decision tree hyperparameter 		Minimum number of data points allowed in a leaf node
Max features 	Decision Tree hyperparameter 		Maximum number of features considered in a decision tree when splitting nodes
Bootstrap  	Decision Tree hyperparameter 		Method for sampling data point with or without replacement

Hyperparameter Tuning	Function Type			Process of optimizing model parameters other than data parameters (like learning rate	 number of trees).
Grid search	Hyperparameter Tuning 	Grid search checks every combination of hyperparameters  	Grid search is exhaustive, checking every value within specified ranges	However, grid search only checks within the specified hyperparameter ranges and is computationally expensive and can only check discrete values
Random Search	Hyperparameter Tuning 	Random search checks a random subset of combinations of hyperparameters, either sampling with or without replacement 	Random search can increase hyperparameter ranges without increasing the number of checks tested	Random search like grid search only checks within the specified hyperparameter ranges and can only check discrete values
Bayesian Optimization	Hyperparameter Tuning 	Applies informed changes to hyperparameters checked, based on information from previous checks 	Can reach the optimal configurations quicker than grid or random search 	Mostly only useful for large models since smaller models can be checked quickly with grid search
K-fold cross validation with hyperparameter tuning 	Hyperparameter Tuning 	Its useful to combine k-fold cross validation with hyperparameter search methods, performing k-fold cross validation with each hyperparameter configuration for can example with grid search

Data Augmentation	Function Type 		Can involve scaling, cropping, flipping, or rotating image data or applying changes like random noise or dropping random values to data in general 	Helps generalize and generates new data records/features based on existing data and makes it harder to memorize irrelevant information like over-specific information or noise via training examples or features
Mixup	Data Augmentation and Generalization and Regularization Method 	Randomly mixes data like by overlapping images 	Mixup increases data diversity 	However Mixup also can create blurred images 
Cutout	Data Augmentation and Generalization and Regularization Method 	Randomly removes square sections of images during training 	Cutout can remove noise, making models more robust 	However cutout can also remove important features especially in sparse images	
CutMix	Data Augmentation and Generalization and Regularization Method 	Randomly mixes a subset of input images and mixes labels according to the proportion of the image subsets 	Cutmix increases data diversity 	However cutmix also can create unrealistic images and can remove important features especially in sparse images

Model Interpretability & Explainability	Function Type			Understanding how a model makes decisions
SHAP (shapley additive explanations)	Model Interpretability	The shapley value for feature i is: φᵢ = Σ [|S|!(M-|S|-1)!/M!] × [f(S ∪ {i}) – f(S)] where S represents all possible subsets of features excluding feature i, and f represents the model’s prediction function 	SHAP calculates feature importance by considering all possible combinations of features and measuring how much each feature contributes to the difference between the current and average prediction, ensuring that the sum of all SHAP values equals the difference between the individual and average prediction, where features that contribute equally have equal SHAP values, positively/negatively contributing features have positive/negative values, and features that dont contribute have zero SHAP values and SHAP values can be computed by summing values from individual components 	SHAP is rigorous, has consistent explanations, integrates global and local info, is efficient by optimizing for model types, enables rich visualizations and is additive and is better for complex models 	However SHAP is computationally complex, has errors from approximations, is sensitive to the choice of baseline value, doesnt handle correlated features well, and requires careful selection of datasets
LIME (local interpretable model-agnostic explanations)	Model Interpretability 	Lime explains individual predictions by learning an interpretable model locally around the prediction by perturbing relevant input features around a specific instance and observing how predictions change, first perturbing data, then collecting predictions, then assigning higher weights to closer samples, then training a local model using algorithms like linear regression, then generates explanations based on coefficients of the local model 		LIME is useful bc of its model agnosticism, instance-specific explanations, intuitive output, flexible data type handling, and local fidelity, accurately approximating model behavior in the local neighborhood of the explained instance 	However LIME is unstable/volatile/inconsistent with small input changes leading to very different explanations due to random sampling and is dependent on sampling strategy used for perturbations, uses and reflects limited global info, is computationally expensive and is sensitive to hyperparameters and is better for simpler models
Feature importance plots	Model Interpretability
DeepLIFT	Deep learning interpretability method
Grad-CAM	Deep learning interpretability method
Integrated Gradients	Deep learning interpretability method

Activation functions	Function Type			Specifies whether a neural network node should be activated thereby allowing that set of weights to contribute to the model
Step	Activation function 	1 if x >=0 or 0 if x < 0
